Isbn,BookTitle,Author,ImageUrl,Description,AvailableCopies,TotalCopies
9.78E+12,The Girl on the Train,Paula Hawkins,https://covers.openlibrary.org/b/isbn/9781594634024-L.jpg,"A gripping mystery involving memory, perception, and truth",20,20
9.78E+12,The Midnight Library,Matt Haig,https://covers.openlibrary.org/b/isbn/9780385545969-L.jpg,A novel about alternate lives and choices explored through a magical library,20,20
9.78E+12,Where the Crawdads Sing,Delia Owens,https://covers.openlibrary.org/b/isbn/9780525555370-L.jpg,A mystery intertwined with nature and loneliness in the marshlands,20,20
9.78E+12,Verity,Colleen Hoover,https://covers.openlibrary.org/b/isbn/9780062963673-L.jpg,A dark romance thriller filled with suspense and shocking truths,20,20
9.78E+12,Educated,Tara Westover,https://covers.openlibrary.org/b/isbn/9780735211292-L.jpg,A memoir about a woman who grows up isolated and pursues education,20,20
9.78E+12,The Silent Patient,Alex Michaelides,https://covers.openlibrary.org/b/isbn/9781982137274-L.jpg,A psychological thriller about a woman who stops speaking after a crime,20,20